filename,artist_name,art_description,artist_link
sample_art_1.jpg,Dream Fan Artist,Happy Birthday Dream! Amazing speedrun celebration art,https://twitter.com/elevenisrising
sample_art_2.jpg,MinecraftMaster,Epic manhunt chase scene with Dream's signature moves,https://twitter.com/elevenisrising
sample_art_3.jpg,PixelCreator,Beautiful portrait of Dream with his iconic smile,https://twitter.com/elevenisrising
sample_art_4.jpg,ArtisticDreamer,Dream SMP birthday party with all the characters,https://twitter.com/elevenisrising
sample_art_5.jpg,DigitalDream,Stunning face reveal tribute artwork,https://twitter.com/elevenisrising
sample_art_6.jpg,CreativeFan,Dream's music and gaming journey combined,https://twitter.com/elevenisrising